{
  "schema": "chronicle.chapter-artifact",
  "version": "0.2",
  "chapter_id": "ch_756922e9af0d759d29d7475f",
  "revision_id": "rev_c2r2_demo_001",
  "source_sha256": "85cf2b792b639c566b2c539e185f95636efd9fd46875a031ebab0a8767343c28",
  "normalized_sha256": "85cf2b792b639c566b2c539e185f95636efd9fd46875a031ebab0a8767343c28",
  "candidate": {
    "schema": "chronicle.chapter-candidate",
    "version": "0.2",
    "chapter_id": "ch_756922e9af0d759d29d7475f",
    "bundle": {
      "schema_version": "0.1",
      "source": {
        "temp_id": "src_001",
        "kind": "source",
        "source_type": "book",
        "title": "contract fixture",
        "author": null,
        "language": "zh-CN",
        "edition": null,
        "citation": null,
        "url": null,
        "metadata": {},
        "extraction": {
          "method": "model",
          "job_id": "c2r2-contract",
          "confidence": 0.9
        }
      },
      "entities": [
        {
          "temp_id": "ent_001",
          "kind": "entity",
          "type": "person",
          "canonical_name": "曹操",
          "aliases": [
            "操"
          ],
          "mentions": [
            {
              "text": "曹操"
            },
            {
              "text": "操"
            }
          ],
          "description": null,
          "attributes": {},
          "resolution": {
            "status": "unresolved"
          },
          "extraction": {
            "method": "model",
            "job_id": "c2r2-contract",
            "confidence": 0.9
          }
        },
        {
          "temp_id": "ent_002",
          "kind": "entity",
          "type": "person",
          "canonical_name": "周瑜",
          "aliases": [],
          "mentions": [
            {
              "text": "周瑜"
            }
          ],
          "description": null,
          "attributes": {},
          "resolution": {
            "status": "unresolved"
          },
          "extraction": {
            "method": "model",
            "job_id": "c2r2-contract",
            "confidence": 0.9
          }
        },
        {
          "temp_id": "ent_003",
          "kind": "entity",
          "type": "place",
          "canonical_name": "赤壁",
          "aliases": [],
          "mentions": [
            {
              "text": "赤壁"
            }
          ],
          "description": null,
          "attributes": {},
          "resolution": {
            "status": "unresolved"
          },
          "extraction": {
            "method": "model",
            "job_id": "c2r2-contract",
            "confidence": 0.9
          }
        },
        {
          "temp_id": "ent_004",
          "kind": "entity",
          "type": "place",
          "canonical_name": "江陵",
          "aliases": [],
          "mentions": [
            {
              "text": "江陵"
            }
          ],
          "description": null,
          "attributes": {},
          "resolution": {
            "status": "unresolved"
          },
          "extraction": {
            "method": "model",
            "job_id": "c2r2-contract",
            "confidence": 0.9
          }
        }
      ],
      "events": [
        {
          "temp_id": "evt_001",
          "kind": "event",
          "type": "battle",
          "title": "赤壁之戰",
          "summary": null,
          "time": {
            "original_text": "建安十三年",
            "source_calendar": {
              "system": "chinese_lunisolar_regnal",
              "era": "建安",
              "era_year": 13,
              "season": null,
              "month": null,
              "day": null,
              "inherited_fields": []
            },
            "normalized": {
              "calendar": "proleptic_gregorian",
              "year": null,
              "month": null,
              "day": null,
              "precision": "unknown",
              "conversion_status": "unresolved",
              "approximate": false
            }
          },
          "participants": [
            {
              "entity_ref": "ent_001",
              "role": "commander"
            },
            {
              "entity_ref": "ent_002",
              "role": "commander"
            }
          ],
          "places": [
            "ent_003"
          ],
          "parent_event_ref": null,
          "extraction": {
            "method": "model",
            "job_id": "c2r2-contract",
            "confidence": 0.9
          }
        },
        {
          "temp_id": "evt_002",
          "kind": "event",
          "type": "movement",
          "title": "屯江陵",
          "summary": null,
          "time": {
            "original_text": "建安十三年",
            "source_calendar": {
              "system": "chinese_lunisolar_regnal",
              "era": "建安",
              "era_year": 13,
              "season": null,
              "month": null,
              "day": null,
              "inherited_fields": []
            },
            "normalized": {
              "calendar": "proleptic_gregorian",
              "year": null,
              "month": null,
              "day": null,
              "precision": "unknown",
              "conversion_status": "unresolved",
              "approximate": false
            }
          },
          "participants": [
            {
              "entity_ref": "ent_001",
              "role": "commander"
            }
          ],
          "places": [
            "ent_004"
          ],
          "parent_event_ref": null,
          "extraction": {
            "method": "model",
            "job_id": "c2r2-contract",
            "confidence": 0.9
          }
        },
        {
          "temp_id": "evt_003",
          "kind": "event",
          "type": "retreat",
          "title": "退兵",
          "summary": null,
          "time": null,
          "participants": [],
          "places": [],
          "parent_event_ref": null,
          "extraction": {
            "method": "model",
            "job_id": "c2r2-contract",
            "confidence": 0.9
          }
        },
        {
          "temp_id": "evt_004",
          "kind": "event",
          "type": "military",
          "title": "觀兵",
          "summary": null,
          "time": {
            "original_text": "建安十三年",
            "source_calendar": {
              "system": "chinese_lunisolar_regnal",
              "era": "建安",
              "era_year": 13,
              "season": null,
              "month": null,
              "day": null,
              "inherited_fields": []
            },
            "normalized": {
              "calendar": "proleptic_gregorian",
              "year": null,
              "month": null,
              "day": null,
              "precision": "unknown",
              "conversion_status": "unresolved",
              "approximate": false
            }
          },
          "participants": [
            {
              "entity_ref": "ent_001",
              "role": "commander"
            }
          ],
          "places": [
            "ent_003"
          ],
          "parent_event_ref": null,
          "extraction": {
            "method": "model",
            "job_id": "c2r2-contract",
            "confidence": 0.9
          }
        }
      ],
      "claims": [
        {
          "temp_id": "clm_001",
          "kind": "claim",
          "subject": {
            "kind": "entity",
            "ref": "ent_001"
          },
          "predicate": "stationed_at",
          "object": {
            "kind": "entity",
            "ref": "ent_004"
          },
          "time": null,
          "evidence": {
            "text": "曹操屯江陵",
            "source_ref": "src_001",
            "locator": {}
          },
          "assessment": {
            "status": "unassessed",
            "note": null
          },
          "extraction": {
            "method": "model",
            "job_id": "c2r2-contract",
            "confidence": 0.9
          }
        }
      ],
      "warnings": []
    },
    "translation": {
      "language": "zh-CN",
      "blocks": [
        {
          "block_id": "t_001",
          "text": "建安十三年，曹操屯兵江陵。",
          "source_block_ids": [
            "b_001"
          ],
          "entity_refs": [
            {
              "kind": "entity",
              "ref": "ent_001"
            },
            {
              "kind": "entity",
              "ref": "ent_004"
            }
          ],
          "event_refs": [
            {
              "kind": "event",
              "ref": "evt_002"
            }
          ]
        },
        {
          "block_id": "t_002",
          "text": "𠀋操在赤壁閱兵；周瑜在赤壁擊敗曹操。",
          "source_block_ids": [
            "b_002",
            "b_003"
          ],
          "entity_refs": [
            {
              "kind": "entity",
              "ref": "ent_001"
            },
            {
              "kind": "entity",
              "ref": "ent_002"
            },
            {
              "kind": "entity",
              "ref": "ent_003"
            }
          ],
          "event_refs": [
            {
              "kind": "event",
              "ref": "evt_004"
            },
            {
              "kind": "event",
              "ref": "evt_001"
            }
          ]
        },
        {
          "block_id": "t_003",
          "text": "其人聽聞後君王下令退兵。",
          "source_block_ids": [
            "b_004"
          ],
          "entity_refs": [],
          "event_refs": [
            {
              "kind": "event",
              "ref": "evt_003"
            }
          ]
        }
      ]
    },
    "mentions": [
      {
        "mention_id": "m_001",
        "surface": "曹操",
        "contextual": false,
        "status": "resolved",
        "target_ref": "ent_001",
        "candidate_refs": [],
        "selection": {
          "first_block_id": "b_001",
          "last_block_id": "b_001",
          "quote": "曹操",
          "occurrence": 1
        }
      },
      {